	en	fr	es	el	it	ar	de
synthetic_image_detection_label	Media link	Media lien	Media link	σύνδεσμος πολυμέσων	Collegamento multimediale	رابط الوسائط	Medienlink
synthetic_image_detection_name	Synthetic Image Detection	Détection d'image synthétique	Detección de imágenes sintéticas	Ανίχνευση συνθετικής εικόνας	Rilevamento di immagini sintetiche	كشف الصور الاصطناعية	Synthetische Bilderkennung
synthetic_image_detection_placeholder	Paste the URL here	Collez le lien ici	Pega aquí el link	Επικολλήστε τη διεύθυνση σύνδεσμος εδώ	Incolla l'URL qui	الصق عنوان URL هنا	Fügen Sie die URL hier ein
synthetic_image_detection_results	Results of the clip selected	Résultats du clip sélectionné	Resultados del clip seleccionado	Αποτελέσματα του επιλεγμένου κλιπ	Risultati della clip selezionata	نتائج المقطع المحدد	Ergebnisse des ausgewählten Clips
synthetic_image_detection_link	Image link	Lien image	Link de la imagen	Σύνδεσμος εικόνας	Collegamento immagine	رابط الصورة	Bildlink
synthetic_image_detection_gan_name	GAN	RAG	RAG	GAN	GAN	GAN	GAN
synthetic_image_detection_gan_description	This method aims to detect if the image has been generated by a Generative Adversarial Network (GAN).	Cette méthode vise à détecter si l'image a été générée par un réseau antagoniste génératif (RAG).	Este metodo trata de detectar si la imagen ha sido generada por una red generativa adversativa (RAG).	Αυτή η μέθοδος στοχεύει να ανιχνεύσει εάν η εικόνα έχει δημιουργηθεί από ένα Generative Adversarial Network (GAN).	Questo metodo mira a rilevare se l'immagine è stata generata da una Generative Adversarial Network (GAN).	تهدف هذه الطريقة إلى اكتشاف ما إذا كانت الصورة قد تم إنشاؤها بواسطة شبكة الخصومة التوليدية (GAN).	Diese Methode zielt darauf ab zu erkennen, ob das Bild von einem generativen kontroversem Netzwerk (GAN) generiert wurde.
synthetic_image_detection_diffusion_name	Latent Diffusion model	Modèle de diffusion latent	Modelo de difusión latente	Μοντέλο λανθάνουσας διάχυσης	Modello di diffusione latente	نموذج الانتشار الكامن	Modell der latenten Diffusion
synthetic_image_detection_diffusion_description	This method aims to detect if the image has been generated through a diffusion model neural network.	Cette méthode vise à détecter si l'image a été générée par un modèle neuronal de diffusion.	Este metodo trata de detectar si la image ha sigo generada por un modelo neuronal de difusión.	Αυτή η μέθοδος στοχεύει να ανιχνεύσει εάν η εικόνα έχει δημιουργηθεί μέσω ενός νευρωνικού δικτύου μοντέλου διάχυσης.	Questo metodo mira a rilevare se l'immagine è stata generata attraverso una rete neurale con modello di diffusione.	تهدف هذه الطريقة إلى اكتشاف ما إذا كانت الصورة قد تم إنشاؤها من خلال شبكة عصبية لنموذج الانتشار.	Diese Methode zielt darauf ab, festzustellen, ob das Bild durch ein neuronales Diffusionsmodell -Netzwerk erzeugt wurde.
synthetic_image_detection_progan_name	ProGAN	ProGAN	ProGAN	ProGAN	ProGAN	ProGAN	ProGAN
synthetic_image_detection_progan_description	This model can detect fully synthetic images generated by ProGAN Models or architectures that are similar. The model's architecture is a variant of  ResNet50, including an initial layer for residual extraction and with no downsampling in the first layer. The model is not pretrained and strong augmentations are carried out including blurring, compression, gaussian noise adding, geometric transformations, cut-out, and brightness and contrast changes.	Ce modèle peut détecter des images entièrement synthétiques générées par des modèles ProGAN ou des architectures similaires. L'architecture du modèle est une variante de ResNet50, comprenant une couche initiale pour l'extraction des résidus et sans réduction d'échantillonnage dans la première couche. Le modèle n'est pas pré-entraîné et des augmentations importantes sont effectuées, notamment le flou, la compression, l'ajout de bruit gaussien, les transformations géométriques, le cut-out, ainsi que des modifications de luminosité et de contraste.	Este modelo puede detectar imágenes completamente sintéticas generadas por modelos ProGAN o arquitecturas similares. La arquitectura del modelo es una variante de ResNet50, que incluye una capa inicial para la extracción residual y sin reducción en la primera capa. El modelo no está preentrenado y se realizan fuertes aumentos, incluyendo desenfoque, compresión, adición de ruido gaussiano, transformaciones geométricas, cut-out y cambios de brillo y contraste.	Αυτό το μοντέλο μπορεί να ανιχνεύσει πλήρως συνθετικές εικόνες που παράγονται από μοντέλα ProGAN ή αρχιτεκτονικές που είναι παρόμοιες. Η αρχιτεκτονική του μοντέλου είναι μια παραλλαγή του ResNet50, περιλαμβάνοντας μια αρχική στρώση για την εξαγωγή υπολοίπων χωρίς μείωση του δείγματος στην πρώτη στρώση. Το μοντέλο δεν είναι προ-εκπαιδευμένο και γίνονται ισχυρές αυξήσεις περιλαμβανομένων του θολώματος, της συμπίεσης, της προσθήκης θορύβου Gaussian, των γεωμετρικών μετασχηματισμών, του cut-out και των αλλαγών φωτεινότητας και αντίθεσης.	This model can detect fully synthetic images generated by ProGAN Models or architectures that are similar. The model's architecture is a variant of  ResNet50, including an initial layer for residual extraction and with no downsampling in the first layer. The model is not pretrained and strong augmentations are carried out including blurring, compression, gaussian noise adding, geometric transformations, cut-out, and brightness and contrast changes.	يمكن لهذا النموذج اكتشاف الصور الاصطناعية بشكل كامل التي تم إنشاؤها بواسطة نماذج ProGAN أو هندسات مماثلة. تعتبر هندسة النموذج متغيرة من ResNet50 ، بما في ذلك طبقة بداية لاستخراج البقايا وبدون تخفيض في الطبقة الأولى. النموذج ليس معتمدًا مسبقًا ويتم إجراء تعزيزات قوية بما في ذلك التشويش والضغط وإضافة الضوضاء الغاوسية والتحولات الهندسية والقطع وتغييرات السطوع والتباين.	Dieses Modell kann vollständig synthetische Bilder erkennen, die von Progan -Modellen oder -Architekturen erzeugt werden, die ähnlich sind. Die Architektur des Modells ist eine Variante von ResNet50, einschließlich einer Anfangsschicht für die Restextraktion und ohne Down -Sampling in der ersten Schicht. Das Modell ist nicht vorgezogen und es werden starke Augmentationen durchgeführt, einschließlich Unschärfe, Komprimierung, Gaußschen Rauschen, geometrische Transformationen, Ausschnitte sowie Helligkeit und Kontraständerungen.
synthetic_image_detection_adm_name	 ADM	 ADM	 ADM	 ADM	 ADM	 ADM	ADM
synthetic_image_detection_adm_description	This model can detect fully synthetic images generated by ADMs or architectures that are similar. The model's architecture is a variant of  ResNet50, including an initial layer for residual extraction and with no downsampling in the first layer. The model is not pretrained and strong augmentations are carried out including blurring, compression, gaussian noise adding, geometric transformations, cut-out, and brightness and contrast changes.	Ce modèle peut détecter des images entièrement synthétiques générées par des ADMs ou des architectures similaires. L'architecture du modèle est une variante de ResNet50, comprenant une couche initiale pour l'extraction des résidus et sans réduction d'échantillonnage dans la première couche. Le modèle n'est pas préentraîné et des augmentations importantes sont effectuées, notamment le flou, la compression, l'ajout de bruit gaussien, les transformations géométriques, le cut-out, ainsi que des modifications de luminosité et de contraste.	Este modelo puede detectar imágenes completamente sintéticas generadas por ADMs o arquitecturas similares. La arquitectura del modelo es una variante de ResNet50, que incluye una capa inicial para la extracción residual y sin reducción en la primera capa. El modelo no está preentrenado y se realizan fuertes aumentos, incluyendo desenfoque, compresión, adición de ruido gaussiano, transformaciones geométricas, cut-out y cambios de brillo y contraste.	Αυτό το μοντέλο μπορεί να ανιχνεύσει πλήρως συνθετικές εικόνες που παράγονται από ADMs ή αρχιτεκτονικές που είναι παρόμοιες. Η αρχιτεκτονική του μοντέλου είναι μια παραλλαγή του ResNet50, περιλαμβάνοντας μια αρχική στρώση για την εξαγωγή υπολοίπων χωρίς μείωση του δείγματος στην πρώτη στρώση. Το μοντέλο δεν είναι προ-εκπαιδευμένο και γίνονται ισχυρές αυξήσεις περιλαμβανομένων του θολώματος, της συμπίεσης, της προσθήκης θορύβου Gaussian, των γεωμετρικών μετασχηματισμών, του cut-out και των αλλαγών φωτεινότητας και αντίθεσης.	Questo modello è in grado di rilevare immagini completamente sintetiche generate da ADM o architetture simili. L'architettura del modello è una variante di ResNet50, comprendente uno strato iniziale per l'estrazione dei residui e senza downsampling nel primo strato. Il modello non è pre-addestrato e vengono eseguiti forti miglioramenti tra cui sfocatura, compressione, aggiunta di rumore gaussiano, trasformazioni geometriche, ritaglio e modifiche di luminosità e contrasto.	يمكن لهذا النموذج اكتشاف الصور الاصطناعية بشكل كامل التي تم إنشاؤها بواسطة ADMs أو هندسات مماثلة. تعتبر هندسة النموذج متغيرة من ResNet50 ، بما في ذلك طبقة بداية لاستخراج البقايا وبدون تخفيض في الطبقة الأولى. النموذج ليس معتمدًا مسبقًا ويتم إجراء تعزيزات قوية بما في ذلك التشويش والضغط وإضافة الضوضاء الغاوسية والتحولات الهندسية والقطع وتغييرات السطوع والتباين.	Dieses Modell kann vollständig synthetische Bilder erkennen, die von ADMS oder Architekturen erzeugt werden, die ähnlich sind. Die Architektur des Modells ist eine Variante von ResNet50, einschließlich einer Anfangsschicht für die Restextraktion und ohne Down -Sampling in der ersten Schicht. Das Modell ist nicht vorgezogen und es werden starke Augmentationen durchgeführt, einschließlich Unschärfe, Komprimierung, Gaußschen Rauschen, geometrische Transformationen, Ausschnitte sowie Helligkeit und Kontraständerungen.
synthetic_image_detection_progan_rine_mever_name	ProGAN RINE	ProGAN RINE	ProGAN RINE	ProGAN RINE	ProGAN RINE	ProGAN RINE	ProGAN RINE
synthetic_image_detection_progan_rine_mever_description	This model detects fully synthetic images. It specializes in detecting images generated by Generative Adversarial Networks (GAN). The CLIP (Contrastive Language-Image Pre-training) technology extracts key characteristics from the image.	Ce modèle détecte les images entièrement synthétiques. Il se spécialise dans la détection d'images générées par les réseaux antagonistes génératifs (GAN). La technologie CLIP (Pré-entraînement contrastif Langage-Image) extrait les caractéristiques clés de l'image.	Este modelo detecta imágenes completamente sintéticas. Se especializa en la detección de imágenes generadas por redes generativas adversarias (GAN). La tecnología CLIP (Preentrenamiento Contrastivo de Lenguaje-Imagen) extrae características clave de la imagen.	Αυτό το μοντέλο ανιχνεύει πλήρως συνθετικές εικόνες. Ειδικεύεται στην ανίχνευση εικόνων που παράγονται από τους γεννητικούς αντιπαραγωγικούς δίκτυους (GAN). Η τεχνολογία CLIP (Προεκπαίδευση με Αντιθετική Γλώσσα-Εικόνα) εξάγει τα κύρια χαρακτηριστικά από την εικόνα.	Questo modello rileva immagini completamente sintetiche. Si specializza nella rilevazione di immagini generate da reti generative avversarie (GAN). La tecnologia CLIP (Preallenamento Contrastivo Linguaggio-Immagine) estrae caratteristiche chiave dall'immagine.	يكتشف هذا النموذج الصور الاصطناعية بالكامل. إنه متخصص في اكتشاف الصور التي تم إنشاؤها بواسطة شبكات الخصم الانتاجية (GAN). تستخرج تقنية CLIP (التدريب المسبق باللغة والصورة التبايني) السمات الرئيسية من الصورة.	Dieses Modell erkennt vollständig synthetische Bilder. Es hat sich auf die Erkennung von Bildern spezialisiert, die von generativen adversarischen Netzwerken (GAN) generiert wurden, während die CLIP-Technologie (Kontrastive Sprache-Bild-Vorab-Trainings) Schlüsseleigenschaften aus dem Bild extrahiert.
synthetic_image_detection_ldm_rine_mever_name	LDM RINE	LDM RINE	LDM RINE	LDM RINE	LDM RINE	LDM RINE	LDM RINE
synthetic_image_detection_ldm_rine_mever_description	This model detects fully synthetic images. It specializes in detecting images generated by Latent Diffusion Models (LDM), while exhibiting strong detection performance across several other generative methods. The CLIP (Contrastive Language-Image Pre-training) technology extracts key characteristics from the image.	Ce modèle détecte les images entièrement synthétiques. Il se spécialise dans la détection d'images générées par les modèles de diffusion latente (LDM), tout en présentant de solides performances de détection sur plusieurs autres méthodes génératives. La technologie CLIP (Pré-entraînement contrastif Langage-Image) extrait les caractéristiques clés de l'image.	Este modelo detecta imágenes completamente sintéticas. Se especializa en la detección de imágenes generadas por modelos de difusión latente (LDM), mientras exhibe un fuerte rendimiento de detección en varios otros métodos generativos. La tecnología CLIP (Preentrenamiento Contrastivo de Lenguaje-Imagen) extrae características clave de la imagen.	Αυτό το μοντέλο ανιχνεύει πλήρως συνθετικές εικόνες. Ειδικεύεται στην ανίχνευση εικόνων που παράγονται από μοντέλα διάχυσης κρυφής (LDM), ενώ επιδεικνύει ισχυρές επιδόσεις ανίχνευσης σε αρκετές άλλες γεννητικές μεθόδους. Η τεχνολογία CLIP (Προεκπαίδευση με Αντιθετική Γλώσσα-Εικόνα) εξάγει τα κύρια χαρακτηριστικά από την εικόνα.	Questo modello rileva immagini completamente sintetiche. Si specializza nella rilevazione di immagini generate da modelli di diffusione latente (LDM), mostrando nel contempo una forte performance di rilevamento su diversi altri metodi generativi. La tecnologia CLIP (Preallenamento Contrastivo Linguaggio-Immagine) estrae caratteristiche chiave dall'immagine.	يكتشف هذا النموذج الصور الاصطناعية بالكامل. إنه متخصص في اكتشاف الصور التي تم إنشاؤها بواسطة نماذج الانتشار الكامنة (LDM)، مع عرض أداء كشف قوي عبر عدة طرق توليدية أخرى. تستخرج تقنية CLIP (التدريب المسبق باللغة والصورة التبايني) السمات الرئيسية من الصورة.	Dieses Modell erkennt vollständig synthetische Bilder. Es hat sich auf die Erkennung von Bildern spezialisiert, die von latenten Diffusionsmodellen (LDM) generiert wurden, und zeigt dabei eine starke Erkennungsleistung bei verschiedenen anderen generativen Methoden. Die CLIP-Technologie (Kontrastive Sprache-Bild-Vorab-Trainings) extrahiert Schlüsseleigenschaften aus dem Bild.
synthetic_image_detection_title	Detection results	Résultats de la détection	Resultados de la detección	Αποτελέσματα ανίχνευσης		نتائج الكشف	Erkennungsergebnisse
synthetic_image_detection_alert	This image has been detected as generated with a 	Cette image a été détectée comme générée avec un 	Esta imagen ha sido detectada como generada con un 	Αυτή η εικόνα έχει εντοπιστεί ότι δημιουργήθηκε με α	Questa immagine è stata rilevata come generata con a 	 تم اكتشاف هذه الصورة على أنها إنشاؤها باستخدام ملف تم	Dieses Bild wurde als erzeugt mit a erkannt 
synthetic_image_detection_alert_2	 algorithm	 algorithmique	 algorítmico	 algorithm	 algoritmo	 خوارزمية	 Algorithmus
synthetic_image_detection_error_400	Error: Invalid image link. Ensure it points to a publicly accessible image with dimensions between 128x128 and 2000x2000 pixels.	Erreur : Lien d'image invalide. Assurez-vous qu'il pointe vers une image accessible publiquement avec des dimensions entre 128x128 et 2000x2000 pixels.	Error: Enlace de imagen no válido. Asegúrate de que apunte a una imagen accesible públicamente con dimensiones entre 128x128 y 2000x2000 píxeles.	Σφάλμα: Άκυρος σύνδεσμος εικόνας. Βεβαιωθείτε ότι δείχνει προς μια δημόσια προσβάσιμη εικόνα με διαστάσεις από 128x128 έως 2000x2000 pixels.	Errore: collegamento immagine non valido. Assicurati che rimandi a un'immagine accessibile pubblicamente con dimensioni comprese tra 128x128 e 2000x2000 pixel.	خطأ: رابط الصورة غير صالح. تأكد من أنه يشير إلى صورة متاحة علنياً بأبعاد تتراوح بين 128x128 و 2000x2000 بكسل.	Fehler: Ungültiger Bildverbindung. Stellen Sie sicher, dass es auf ein öffentlich zugängliches Bild mit Abmessungen zwischen 128x128 und 2000x2000 Pixel zeigt.
synthetic_image_detection_error_generic	An error happened. Please try again or try a different image	Une erreur s'est produite. Veuillez réessayer ou essayer une image différente.	Se produjo un error. Por favor, inténtalo de nuevo o prueba con una imagen diferente.	Προέκυψε ένα σφάλμα. Παρακαλώ δοκιμάστε ξανά ή δοκιμάστε μια διαφορετική εικόνα.	Si è verificato un errore. Riprova o prova con un'immagine diversa	حدث خطأ. يرجى المحاولة مرة أخرى أو جرب صورة مختلفة.	Ein Fehler trat auf. Bitte versuchen Sie es erneut oder probieren Sie ein anderes Bild aus
synthetic_image_detection_algorithms_errors	One or more algorithms returned errors. The analysis may be incomplete. Make sure the image has dimensions between 128x128 and 2000x2000 pixels.	Un ou plusieurs algorithmes ont renvoyé des erreurs. L'analyse peut être incomplète. Assurez-vous que l'image a des dimensions comprises entre 128x128 et 2000x2000 pixels.	Uno o más algoritmos devolvieron errores. El análisis puede estar incompleto. Asegúrese de que la imagen tenga dimensiones entre 128x128 y 2000x2000 píxeles.	Ένας ή περισσότεροι αλγόριθμοι επέστρεψαν σφάλματα. Η ανάλυση μπορεί να είναι ατελής. Βεβαιωθείτε ότι η εικόνα έχει διαστάσεις μεταξύ 128x128 και 2000x2000 pixel.	Uno o più algoritmi hanno restituito errori. L'analisi potrebbe essere incompleta. Assicurati che l'immagine abbia dimensioni comprese tra 128x128 e 2000x2000 pixel.	أحد أو أكثر من الخوارزميات قد عادت بأخطاء. قد تكون التحليلات غير مكتملة. تأكد من أن الصورة لها أبعاد بين 128x128 و 2000x2000 بكسل.	Einer oder mehrere Algorithmen haben Fehler zurückgegeben. Die Analyse kann unvollständig sein. Stellen Sie sicher, dass das Bild Abmessungen zwischen 128x128 und 2000x2000 Pixel hat.
synthetic_image_detection_not_found	No detection found	Aucune détection	No se encontró ninguna detección	Δεν βρέθηκε ανίχνευση	Nessun rilevamento trovato	لم يتم العثور على كشف	Keine Erkennung gefunden
submit_button	Submit	Envoyer	Enviar	Υποβολή	Invia	إرسال	Einreichen
button_localfile	Local file	Fichier local	Fichero local	Τοπικό αρχείο	Archivio locale	ملف محلي	Lokale Datei
synthetic_image_detection_gauge_detection	Detection	Détection	Detección	Ανίχνευση	Rilevamento	الكشف	Erkennung
synthetic_image_detection_gauge_no_detection	No detection	Aucune détection	Sin detección	Χωρίς ανίχνευση	Nessun rilevamento	لا يوجد كشف	Keine Erkennung
synthetic_image_detection_additional_results	Detection details	Détails de la détection	Detalles de detección	Λεπτομέρειες ανίχνευσης	Dettagli di rilevamento	تفاصيل الكشف	Erkennungsdetails
synthetic_image_detection_additional_results_hide	Hide detection details	Masquer les détails de la détection	Ocultar detalles de detección	Απόκρυψη λεπτομερειών ανίχνευσης	Nascondi dettagli rilevamento	إخفاء تفاصيل الكشف	Detektiondetails ausblenden
synthetic_image_detection_rating	Explanation: The veraAI detector of the InVID-WeVerify plugin finds 	Explication : Le détecteur veraAI du plugin InVID-WeVerify a trouvé 	Explicación: El detector veraAI del plugin InVID-WeVerify encontro 	Εξήγηση: Βρίσκει ο ανιχνευτής veraAI της προσθήκης InVID-WeVerify 	Spiegazione: I rilevatore veraAI del plugin InVID-WeVerify trova 	توضيح: تم العثور على كاشف veraAI الخاص بالبرنامج المساعد InVID-WeVerifyتفسي:	Erklärung: Der veraAI-Detektor des InVID-WeVerify-Plugins hat gefinden
synthetic_image_detection_rating_4	very strong evidence suggesting that this image is synthetic	très fortes preuves suggérant que cette image est synthétique	muy fuertes evidencias sugiriendo que esta imagen es sintética	πολύ δυνατές ενδείξεις που υποδεικνύουν ότι αυτή η εικόνα είναι συνθετική	prove molto forti che suggeriscono che questa immagine è sintetica	دلائل قوية جدا تشير إلى أن هذه الصورة اصطناعية	sehr starke hinweise darauf, dass dieses bild synthetisch ist
synthetic_image_detection_rating_3	strong evidence suggesting that this image is synthetic	des preuves solides suggérant que cette image est synthétique	fuertes evidencias sugiriendo que esta imagen es sintética	δυνατά ενδείξεις που υποδεικνύουν ότι αυτή η εικόνα είναι συνθετική	forti evidenze che suggeriscono che questa immagine è sintetica	دلائل قوية تشير إلى أن هذه الصورة اصطناعية	starke hinweise darauf, dass dieses bild synthetisch ist
synthetic_image_detection_rating_2	moderate evidence (suspicious but non conclusive) suggesting that this image could be synthetic. The absence of detection does not guarantee the image is not post-edited.	preuves modérées (suspectes mais non concluantes) suggérant que cette image pourrait être synthétique. L'absence de détection ne garantit pas que l'image n'a pas été post-éditée.	evidencia moderada (sospechosa pero no concluyente) que sugiere que esta imagen pueda ser sintética. La ausencia de detección no garantiza que la imagen no haya sido editada posteriormente.	μέτρια στοιχεία (ύποπτα μη αλλά πειστικά) που υποδεικνύουν ότι αυτή η εικόνα είναι συνθετική. Η απουσία ανίχνευσης δεν εγγυάται ότι η εικόνα δεν έχει επεξεργαστεί μετά.	evidenze moderate (sospette ma non conclusive) che suggeriscono che questa immagine potrebbe essere sintetica. L'assenza di rilevamento non garantisce che l'immagine non sia stata post-editata.	أدلة معتدلة (مشبوهة ولكنها غير قاطعة) تشير إلى أن هذه الصورة يمكن أن تكون اصطناعية. لا يضمن عدم الكشف أن الصورة لم تكن محرفة بعد ذلك.	moderate (verdächtig, aber nicht schlüssig) hinweise darauf, dass dieses bild synthetisch sein könnte. Das Fehlen einer Erkennung garantiert nicht, dass das Bild nicht nachbearbeitet wurde.
