	en	fr	es	el	it
copyright_title	Check Video Copyright Status	Vérifier le copyright de la vidéo	Verificar los derechos de autor del video	Ελέγξτε τα δικαιώματα πνευματικής ιδιοκτησίας του βίντεο	Controlla lo stato del copyright video
copyright_input	YouTube or Twitter video link	Lien YouTube ou Twitter	Enlance YouTube o Twitter	Σύνδεσμος βίντεο στο YouTube ή στο Twitter	Link video YouTube o Twitter
copyright_input_placeholder	Paste here the link	Copier ici le lien	Copiar aquí el enlace	επικολλήστε εδώ τον σύνδεσμο	Incolla qui il link
button_submit	Submit	Envoyer	Enviar	Υποβολή	Invia
keyframes_error_default	Unknown error occured. Please try again later or with another video.	Une erreur inconnue s'est produite. Veuillez réessayer plus tard ou avec une autre vidéo.	Se ha producido un error desconocido. Por favor, inténtelo de nuevo más tarde o con otro vídeo.	Άγνωστο σφάλμα. Παρακαλούμε δοκιμάστε αργότερα ή δοκιμάστε κάποιο άλλο βίντεοcardheader_link	Errore sconosciuto si è verificato. Si prega di riprovare più tardi o con un altro video.
cardheader_results	Results	Résultats	Resultados	Αποτελέσματα	Risultati
cardheader_link	Source of the video	Source de la vidéo	Fuente del video	Πηγή του βίντεο	Fonte del video